{
  "case_id": "apa-006b-epb-hold-01",
  "symptom": "EPB保持时间临界值：1.49s。",
  "depth": "standard",
  "recording": "recordings/apa-006b-epb-hold-01.mcap",
  "expected": {
    "clock": "log_time",
    "anchor": {
      "topic": "/functions/parking_pnc/apa_state",
      "field": "exit_reason",
      "predicate": "eq 21",
      "last_good": 6.0,
      "first_bad": 6.49
    },
    "window_secs": [
      5.0,
      6.69
    ],
    "route": [
      {
        "topic": "/sensor/chassis/vehicle_status",
        "field": "epb",
        "max_age_ms": 50
      }
    ],
    "boundary": "vehicle EPB debounce -> APA state machine",
    "confidence": "medium"
  },
  "labels": {
    "class": "epb-debounce-boundary",
    "epb_hold_s": 1.49,
    "threshold_s": 1.5,
    "exit_reason": 21
  },
  "record_count": 58
}
