{
  "case_id": "apa-004d-slot-yaw-02",
  "symptom": "车位角度临界值：0.7854rad。",
  "depth": "standard",
  "recording": "recordings/apa-004d-slot-yaw-02.mcap",
  "expected": {
    "anchor_status": "all_good",
    "route": [],
    "confidence": "high"
  },
  "labels": {
    "class": "slot-yaw-boundary",
    "slot_yaw_rad": 0.7854,
    "valid_range_rad": [
      0.7854,
      1.6708
    ],
    "expected_invalid": false,
    "error_code": 0
  },
  "record_count": 49
}
