{
  "case_id": "apa-008c-validity-duration-01",
  "symptom": "障碍物valid=false持续1个周期。",
  "depth": "standard",
  "recording": "recordings/apa-008c-validity-duration-01.mcap",
  "expected": {
    "clock": "log_time",
    "anchor": {
      "topic": "/functions/perception/obstacle_pk",
      "field": "valid",
      "predicate": "eq false",
      "last_good": 4.0,
      "first_bad": 5.0
    },
    "window_secs": [
      4.0,
      6.5
    ],
    "specialist": "apa_perception_analysis",
    "inputs": [
      {
        "topic": "/functions/perception/obstacle_pk",
        "field": "object_id",
        "max_age_ms": 100
      }
    ],
    "question": "valid=false持续1周期时，是否为感知首个分歧而非决策误判?",
    "boundary": "perception obstacle gate",
    "confidence": "high"
  },
  "labels": {
    "class": "perception-validity-duration",
    "bad_duration_cycles": 1,
    "replan": true
  },
  "record_count": 63
}
