{
  "case_id": "apa-004b-slot-id-01",
  "symptom": "选择车位 ID 边界：slot_id=0。",
  "depth": "standard",
  "recording": "recordings/apa-004b-slot-id-01.mcap",
  "expected": {
    "clock": "log_time",
    "anchor": {
      "topic": "/functions/parking_pnc/apa_planning_trajectory",
      "field": "trajectory_num",
      "predicate": "eq 0",
      "last_good": 3.0,
      "first_bad": 4.0
    },
    "window_secs": [
      3.0,
      4.5
    ],
    "specialist": "apa_planning_analysis",
    "inputs": [
      {
        "topic": "/functions/perception/parking_slot_info",
        "field": "slot_id",
        "max_age_ms": 150
      }
    ],
    "question": "slot_id=0是否被规划器判定为无效并导致轨迹数归零？",
    "boundary": "slot identity -> planning trajectory",
    "confidence": "high"
  },
  "labels": {
    "class": "slot-id-boundary",
    "slot_id": 0,
    "error_code": 214,
    "initiating_cause": "invalid selected slot"
  },
  "record_count": 49
}
