{
  "case_id": "apa-004c-slot-width-01",
  "symptom": "车位宽度临界值：1.19m。",
  "depth": "standard",
  "recording": "recordings/apa-004c-slot-width-01.mcap",
  "expected": {
    "clock": "log_time",
    "anchor": {
      "topic": "/functions/parking_pnc/apa_planning_trajectory",
      "field": "trajectory_num",
      "predicate": "eq 0",
      "last_good": 3.0,
      "first_bad": 4.0
    },
    "window_secs": [
      3.0,
      4.5
    ],
    "specialist": "apa_planning_analysis",
    "inputs": [
      {
        "topic": "/functions/perception/parking_slot_info",
        "field": "width_m",
        "max_age_ms": 150
      }
    ],
    "question": "slot_width=1.19m在1.20m窄车位阈值哪一侧，是否应产生空轨迹？",
    "boundary": "slot geometry -> planning validity",
    "confidence": "high"
  },
  "labels": {
    "class": "slot-geometry-boundary",
    "slot_width_m": 1.19,
    "narrow_threshold_m": 1.2,
    "expected_invalid": true,
    "error_code": 207
  },
  "record_count": 49
}
