{
  "case_id": "apa-006-epb-interrupt",
  "symptom": "泊车中用户拉起EPB后APA退出。",
  "depth": "quick",
  "recording": "recordings/apa-006-epb-interrupt.mcap",
  "expected": {
    "clock": "log_time",
    "anchor": {
      "topic": "/functions/parking_pnc/apa_state",
      "field": "exit_reason",
      "predicate": "eq 21",
      "last_good": 4.0,
      "first_bad": 5.0
    },
    "window_secs": [
      4.0,
      5.5
    ],
    "route": [
      {
        "topic": "/sensor/chassis/vehicle_status",
        "field": "epb",
        "max_age_ms": 50
      }
    ],
    "boundary": "vehicle_status.epb -> APA state machine",
    "confidence": "high"
  },
  "labels": {
    "class": "user-safety-intervention",
    "initiating_cause": "EPB asserted",
    "necessary_condition": "APA parking active",
    "amplifier": null,
    "consequence": "state exit_reason=21",
    "observability_gap": null
  },
  "record_count": 56
}
